model,column,description,Ontology Definition
customer_top_parent,customer_id,Represents the ID of the customer,
customer_top_parent,top_parent_id,Represents the top parent customer id of the customer,
customer_top_parent,top_parent_company_name,Represents the top parent customer name of the customer,
customer_type,customer_id,Represents the ID of the customer,
customer_type,customer_type,Represents the type of the customer,
netsuite_customer,customer_id,Represents the ID of the customer,
netsuite_customer,is_inactive,Represents the active status of the customer,
netsuite_customer,entity_name,Represents the name of the entity associated with the customer,
netsuite_customer,subsidiary_id,Represents the subsidiary id of the customer,
netsuite_customer,subsidiary,Represents the subsidiary name of the customer,
netsuite_customer,first_name,Represents the firstname of the customer,
netsuite_customer,last_name,Represents the lastname of the customer,
netsuite_customer,address_line_1,Represents the address line_1 of the customer default billing address,
netsuite_customer,address_line_2,Represents the address line_2 of the customer default billing address,
netsuite_customer,city,Represents the city of the customer default billing address,
netsuite_customer,address_state,Represents the state of the customer default billing address,
netsuite_customer,zipcode,Represents the zipcode of the customer default billing address,
netsuite_customer,phone,Represents the phone number of the customer,
netsuite_customer,email,Represents the email address of the customer,
netsuite_customer,company_name,Represents the company name of the customer,
netsuite_customer,first_sale_date,"Represents the date of first sale to the customer. The column in the Netsuite Customer table is a calculated column, and changes to it don't cause changes to the date_last_modified, by Netsuite's design. Per Fivetran, they won't pick up the updates to the column, so users should calculate the value for such columns, off Transaction in this case. In the event a value for the customer isn't found, it defaults to Customer table value.
",
netsuite_customer,last_sale_date,"Represents the date of latest sale to the customer. The column in the Netsuite Customer table is a calculated column, and changes to it don't cause changes to the date_last_modified, by Netsuite's design. Per Fivetran, they won't pick up the updates to the column, so users should calculate the value for such columns, off Transaction in this case. In the event a value for the customer isn't found, it defaults to Customer table value.
",
netsuite_customer,date_of_birth,Represents the date of birth of the customer,
netsuite_customer,do_not_email,Represents the do_not_email status of the customer,
netsuite_customer,do_not_mail,Represents the do_not_mail status the customer,
netsuite_customer,date_created,Represents the created date of the customer,
netsuite_customer,date_last_modified,Represents the last modified date of the customer,
netsuite_customer,customer_deleted,Represents the deleted status of the customer,
netsuite_customer,customer_extid,Represents the external ID of the customer,
netsuite_customer,status_description,Represents the status description of the customer,
netsuite_customer,status,Represents the status name of the customer,
netsuite_customer,customer_type,Represents the type of the customer,
nursing_entity,entity_id,Unique identifier for each entity (nursing_customer_id or nursing_license_id),
nursing_entity,brand_id,Brand ID (NULL for license records),
nursing_entity,brand_name,Brand name (NULL for license records),
nursing_entity,source_system,Source system for customers (NULL for license records),
nursing_entity,customer_id,Customer ID from source system,
nursing_entity,customer_email,Customer email address,
nursing_entity,first_name,Customer first name,
nursing_entity,last_name,Customer last name,
nursing_entity,full_name,Customer full name,
nursing_entity,phone,Customer phone number,
nursing_entity,address,Customer address,
nursing_entity,city,Customer city,
nursing_entity,state,Customer state,
nursing_entity,zip,Customer zip code,
nursing_entity,country,Customer country,
nursing_entity,license_number,Nursing license number (only for license records),
nursing_entity,license_level_name,License level (only for license records),
nursing_entity,license_state,State where license was issued (only for license records),
nursing_entity,profession_name,Profession classification (only for license records),
nursing_entity,customer_license_id,License ID from customer_license_dim (only for license records),
nursing_entity,license_expiration_date,License expiration date (only for license records),
nursing_entity,education_renewal_date,Education renewal date for filtering recent licenses (only for license records),
nursing_entity,do_not_market,Do not market flag from license record (only for license records),
nursing_entity,do_not_mail,Do not mail flag from customer record (only for license records),
nursing_entity,first_sale_date,First sale date,
nursing_entity,last_sale_date,Last sale date,
nursing_entity,entity_type,Entity type - 'customer' or 'license',
nursing_license,nursing_license_id,Surrogate key for the license record (derived from customer_license_id),
nursing_license,customer_license_id,Original license ID from customer_license_dim,
nursing_license,customer_id,Customer ID from Netsuite,
nursing_license,customer_email,"Customer email address (lowercase, trimmed)",
nursing_license,first_name,Customer first name,
nursing_license,last_name,Customer last name,
nursing_license,full_name,Customer full name,
nursing_license,phone,Customer phone number,
nursing_license,address,Customer address,
nursing_license,city,Customer city,
nursing_license,state,Customer state,
nursing_license,zip,Customer zip code,
nursing_license,country,Customer country,
nursing_license,license_number,Nursing license number,
nursing_license,license_level_name,"License level (e.g., RN, LPN)",
nursing_license,license_state,State where license was issued,
nursing_license,profession_name,"Profession classification (Nursing, Nurse Practitioner, or APRN)",
nursing_license,license_expiration_date,License expiration date,
nursing_license,education_renewal_date,Education renewal date for filtering recent licenses,
nursing_license,do_not_market,Do not market flag from license record,
nursing_license,do_not_mail,Do not mail flag from customer record,
nursing_license,first_sale_date,First sale date from Netsuite (NULL if never purchased),
nursing_license,entity_type,Entity type identifier - always 'license' for this model,
nursing_license,dw_update_ts,Data warehouse update timestamp,
brand_mapping_8x8,id,Unique identifier for the call interaction record,
brand_mapping_8x8,brand_id,Unique identifier for the brand/subsidiary from NetSuite,
brand_mapping_8x8,brand_name,Mapped brand name derived from the skill/queue name,
brand_mapping_8x8,ecosystem_id,Unique identifier for the ecosystem the brand belongs to,
brand_mapping_8x8,ecosystem_name,Name of the ecosystem the brand belongs to,
call_fact_8x8,call_id,Unique identifier for the call interaction,
call_fact_8x8,agent_name,Name of the agent handling the call,
call_fact_8x8,brand_id,Unique identifier for the brand/subsidiary from NetSuite,
call_fact_8x8,brand_name,Mapped brand name derived from the skill/queue name,
call_fact_8x8,ecosystem_id,Unique identifier for the ecosystem the brand belongs to,
call_fact_8x8,ecosystem_name,Name of the ecosystem the brand belongs to,
call_fact_8x8,skill,Queue name/skill for the call,
call_fact_8x8,caller_phone_number,Caller phone number,
call_fact_8x8,call_date,Date of the call,
call_fact_8x8,call_ts,Timestamp of the call,
call_fact_8x8,call_time_seconds,Total call processing duration in seconds,
call_fact_8x8,handle_time_seconds,Call handling duration in seconds,
call_fact_8x8,ivr_time_seconds,IVR treatment duration in seconds,
call_fact_8x8,after_call_work_time_seconds,After call work duration in seconds,
call_fact_8x8,total_call_time_seconds,Total call processing duration in seconds (same as call_time_seconds),
call_fact_8x8,total_handle_time_seconds,Total call handling duration in seconds (same as handle_time_seconds),
call_fact_8x8,total_ivr_time_seconds,Total IVR treatment duration in seconds (same as ivr_time_seconds),
call_fact_8x8,total_after_call_work_time_seconds,Total after call work duration in seconds (same as after_call_work_time_seconds),
call_fact_8x8,call_holds,Number of holds during the call,
call_fact_8x8,has_call_transfer,Boolean flag indicating if the call was transferred (based on presence of original_call_id),
call_fact_8x8,is_call_answered,Boolean flag indicating if the call was answered (call_time_seconds > 0),
call_fact_8x8,is_call_missed,Boolean flag indicating if the call was missed (call_time_seconds = 0),
call_fact_8x8,hold_time_seconds,Total hold duration in seconds,
call_fact_8x8,queue_wait_time_seconds,Queue wait duration in seconds,
call_fact_8x8,total_queue_time_seconds,Total queue wait duration in seconds (same as queue_wait_time_seconds),
call_fact_8x8,_fivetran_synced_ts,Timestamp when record was synced by Fivetran,
five9_call_fact,call_id,Unique identifier for each call in the Five9 system,
five9_call_fact,agent_name,The name of the Five9 agent who handled the call,
five9_call_fact,brand_id,"The unique, system-generated ID assigned to the brand/subsidiary",
five9_call_fact,brand_name,Represents the name of the subsidiary/brand,
five9_call_fact,ecosystem_id,Represents the primary ecosystem ID of the subsidiary/brand,
five9_call_fact,ecosystem_name,Represents the primary ecosystem of the subsidiary/brand,
five9_call_fact,brand_campaign,The specific brand that the agent was supporting during this call interaction,
five9_call_fact,skill,"The specific skill or skill group that was required or used for handling the call. Five9 uses skills-based routing to match callers with appropriately skilled agents.
",
five9_call_fact,call_date,Date when the call occurred,
five9_call_fact,call_ts,Timestamp when the call occurred,
five9_call_fact,call_cost,Cost associated with the call based on Five9 billing metrics,
five9_call_fact,contacted_count,Number of successful contacts made during the call,
five9_call_fact,has_pci_call,Boolean flag indicating whether the call involved PCI payment processing,
five9_call_fact,call_billed_time_seconds,"Total billable time for the call, rounded according to Five9 billing rules (in seconds)",
five9_call_fact,call_time_seconds,Total duration of the call from start to finish (in seconds),
five9_call_fact,handle_time_seconds,Total time spent handling the call (talk time + hold time + after call work) (in seconds),
five9_call_fact,talk_time_seconds,Time spent with the agent and caller in active conversation (in seconds),
five9_call_fact,ring_time_seconds,Time the call spent ringing before being answered (in seconds),
five9_call_fact,ivr_time_seconds,Time the caller spent in the Interactive Voice Response (IVR) system (in seconds),
five9_call_fact,after_call_work_time_seconds,Time spent by agents completing post-call tasks (in seconds),
five9_call_fact,pci_call_billed_time_seconds,The rounded billable time for calls routed through the PCI payment processing system (in seconds),
five9_call_fact,pci_call_time_seconds,Total duration of calls processed through the PCI secure payment gateway (in seconds),
five9_call_fact,pci_handle_time_seconds,Total time spent handling the secure payment call (in seconds),
five9_call_fact,pci_talk_time_seconds,Time spent in conversation during the secure payment call (in seconds),
five9_call_fact,pci_ring_time_seconds,Time the call spent ringing before being connected to the PCI secure payment system (in seconds),
five9_call_fact,pci_ivr_time_seconds,Time the caller spent in the Interactive Voice Response (IVR) system before being routed to the PCI secure payment gateway (in seconds),
five9_call_fact,pci_after_call_work_time_seconds,Time spent by agents on post-call administrative tasks after the secure payment call has completed (in seconds),
five9_call_fact,total_call_billed_time_seconds,Combined billable time including both regular call time and PCI call time (in seconds),
five9_call_fact,total_call_time_seconds,Combined total call duration including both regular call time and PCI call time (in seconds),
five9_call_fact,total_handle_time_seconds,Combined handle time including both regular call and PCI call handling time (in seconds),
five9_call_fact,total_talk_time_seconds,Combined talk time including both regular call and PCI call talk time (in seconds),
five9_call_fact,total_ring_time_seconds,Combined ring time including both regular call and PCI call ring time (in seconds),
five9_call_fact,total_ivr_time_seconds,Combined IVR time including both regular call and PCI call IVR time (in seconds),
five9_call_fact,total_after_call_work_time_seconds,Combined after call work time including both regular call and PCI call after work time (in seconds),
five9_call_fact,call_holds,Number of times the call was placed on hold,
five9_call_fact,has_call_transfer,Boolean flag indicating if the call was transferred,
five9_call_fact,is_call_answered,Boolean flag indicating if the call was answered by an agent,
five9_call_fact,is_call_missed,Boolean flag indicating if the call was missed or not answered by an agent,
five9_call_fact,is_call_abandoned,Boolean flag indicating if the call was abandoned by the caller,
five9_call_fact,is_within_sla,Boolean flag indicating if the call was handled within the defined Service Level Agreement (SLA) time of 30 seconds,
five9_call_fact,is_first_call_resolution,Boolean flag indicating if the call was resolved on the first contact without the need for follow-up,
five9_call_fact,third_party_talk_time_seconds,Time spent talking with third parties during call transfers or conferences (in seconds),
five9_call_fact,consult_time_seconds,Time spent by agents consulting with others while the caller is on hold (in seconds),
five9_call_fact,dial_time_seconds,Time spent dialing out (relevant for outbound calls) (in seconds),
five9_call_fact,hold_time_seconds,Total time the caller was placed on hold during the call (in seconds),
five9_call_fact,manual_time_seconds,Time spent on manual activities during the call (in seconds),
five9_call_fact,park_time_seconds,Time the call was in a parked state (in seconds),
five9_call_fact,queue_wait_time_seconds,Time the caller spent waiting in queue before being connected to an agent (in seconds),
five9_call_fact,talk_time_less_hold_and_park_seconds,Talk time excluding periods when the call was on hold or parked (in seconds),
five9_call_fact,time_to_abandon_call_seconds,Time elapsed before an abandoned call was terminated by the caller (in seconds),
five9_call_fact,total_queue_time_seconds,Total time the call spent in any queue (in seconds),
five9_call_fact,last_modified_ts,Timestamp when the record was last modified in the source system,
five9_call_fact,_fivetran_synced_ts,Timestamp when the record was last synced by Fivetran,
five9_call_log_metrics_cleaned,call_id,Unique identifier for each call in the Five9 system,
five9_call_log_metrics_cleaned,agent_name,The name of the Five9 agent who handled the call,
five9_call_log_metrics_cleaned,brand_campaign,The specific brand that the agent was supporting during this call interaction,
five9_call_log_metrics_cleaned,skill,"The specific skill or skill group that was required or used for handling the call. Five9 uses skills-based routing to match callers with appropriately skilled agents.
",
five9_call_log_metrics_cleaned,call_cost,Cost associated with the call based on Five9 billing metrics,
five9_call_log_metrics_cleaned,call_date,Date when the call occurred,
five9_call_log_metrics_cleaned,call_ts,The timestamp when the call occurred,
five9_call_log_metrics_cleaned,after_call_work_time_seconds,Time spent by agents completing post-call tasks (in seconds),
five9_call_log_metrics_cleaned,call_billed_time_seconds,"Total billable time for the call, rounded according to Five9 billing rules",
five9_call_log_metrics_cleaned,call_time_seconds,Total duration of the call from start to finish,
five9_call_log_metrics_cleaned,handle_time_seconds,Total time spent handling the call (talk time + hold time + after call work),
five9_call_log_metrics_cleaned,ring_time_seconds,Time the call spent ringing before being answered,
five9_call_log_metrics_cleaned,talk_time_seconds,Time spent with the agent and caller in active conversation,
five9_call_log_metrics_cleaned,ivr_time_seconds,Time the caller spent in the Interactive Voice Response (IVR) system,
five9_call_log_metrics_cleaned,third_party_talk_time_seconds,Time spent talking with third parties during call transfers or conferences,
five9_call_log_metrics_cleaned,consult_time_seconds,Time spent by agents consulting with others while the caller is on hold,
five9_call_log_metrics_cleaned,dial_time_seconds,Time spent dialing out (relevant for outbound calls),
five9_call_log_metrics_cleaned,hold_time_seconds,Total time the caller was placed on hold during the call,
five9_call_log_metrics_cleaned,manual_time_seconds,Time spent on manual activities during the call,
five9_call_log_metrics_cleaned,park_time_seconds,Time the call was in a parked state,
five9_call_log_metrics_cleaned,queue_wait_time_seconds,Time the caller spent waiting in queue before being connected to an agent,
five9_call_log_metrics_cleaned,talk_time_less_hold_and_park_seconds,Talk time excluding periods when the call was on hold or parked,
five9_call_log_metrics_cleaned,time_to_abandon_call_seconds,Time elapsed before an abandoned call was terminated by the caller,
five9_call_log_metrics_cleaned,total_queue_time_seconds,Total time the call spent in any queue,
five9_call_log_metrics_cleaned,contacted_count,Number of successful contacts made during the call,
five9_call_log_metrics_cleaned,call_holds,Number of times the call was placed on hold,
five9_call_log_metrics_cleaned,has_call_transfer,Boolean flag indicating if the call was transferred,
five9_call_log_metrics_cleaned,is_call_answered,Boolean flag indicating if the call was answered by an agent,
five9_call_log_metrics_cleaned,is_call_missed,Boolean flag indicating if the call was missed or not answered by an agent,
five9_call_log_metrics_cleaned,is_call_abandoned,Boolean flag indicating if the call was abandoned by the caller,
five9_call_log_metrics_cleaned,is_within_sla,Boolean flag indicating if the call was handled within the defined Service Level Agreement (SLA) time of 30 seconds,
five9_call_log_metrics_cleaned,is_first_call_resolution,Boolean flag indicating if the call was resolved on the first contact without the need for follow-up,
five9_call_log_metrics_cleaned,call_transfers,Number of times the call was transferred,
five9_call_log_metrics_cleaned,last_modified_ts,Timestamp when the record was last modified,
five9_call_log_metrics_cleaned,_fivetran_synced_ts,Timestamp when the record was last synced by Fivetran,
five9_call_log_metrics_mapping,ecosystem_id,Represents the primary ecosystem ID of the subsidiary/brand,
five9_call_log_metrics_mapping,ecosystem_name,Represents the primary ecosystem of the subsidiary/brand,
five9_call_log_metrics_mapping,brand_id,"The unique, system-generated ID assigned to the brand/subsidiary",
five9_call_log_metrics_mapping,brand_name,Represents the name of the subsidiary/brand mapped from Five9 skill,
five9_call_log_metrics_mapping,call_id,Unique identifier for each call in the Five9 system,
five9_call_log_metrics_mapping,agent_name,The name of the Five9 agent who handled the call,
five9_call_log_metrics_mapping,brand_campaign,The specific brand that the agent was supporting during this call interaction,
five9_call_log_metrics_mapping,skill,"The specific skill or skill group that was required or used for handling the call. Five9 uses skills-based routing to match callers with appropriately skilled agents.
",
five9_call_log_metrics_mapping,call_cost,Cost associated with the call based on Five9 billing metrics,
five9_call_log_metrics_mapping,call_date,Date when the call occurred,
five9_call_log_metrics_mapping,call_ts,The timestamp when the call occurred,
five9_call_log_metrics_mapping,after_call_work_time_seconds,Time spent by agents completing post-call tasks (in seconds),
five9_call_log_metrics_mapping,call_billed_time_seconds,"Total billable time for the call, rounded according to Five9 billing rules",
five9_call_log_metrics_mapping,call_time_seconds,Total duration of the call from start to finish,
five9_call_log_metrics_mapping,handle_time_seconds,Total time spent handling the call (talk time + hold time + after call work),
five9_call_log_metrics_mapping,ring_time_seconds,Time the call spent ringing before being answered,
five9_call_log_metrics_mapping,talk_time_seconds,Time spent with the agent and caller in active conversation,
five9_call_log_metrics_mapping,ivr_time_seconds,Time the caller spent in the Interactive Voice Response (IVR) system,
five9_call_log_metrics_mapping,third_party_talk_time_seconds,Time spent talking with third parties during call transfers or conferences,
five9_call_log_metrics_mapping,consult_time_seconds,Time spent by agents consulting with others while the caller is on hold,
five9_call_log_metrics_mapping,dial_time_seconds,Time spent dialing out (relevant for outbound calls),
five9_call_log_metrics_mapping,hold_time_seconds,Total time the caller was placed on hold during the call,
five9_call_log_metrics_mapping,manual_time_seconds,Time spent on manual activities during the call,
five9_call_log_metrics_mapping,park_time_seconds,Time the call was in a parked state,
five9_call_log_metrics_mapping,queue_wait_time_seconds,Time the caller spent waiting in queue before being connected to an agent,
five9_call_log_metrics_mapping,talk_time_less_hold_and_park_seconds,Talk time excluding periods when the call was on hold or parked,
five9_call_log_metrics_mapping,time_to_abandon_call_seconds,Time elapsed before an abandoned call was terminated by the caller,
five9_call_log_metrics_mapping,total_queue_time_seconds,Total time the call spent in any queue,
five9_call_log_metrics_mapping,contacted_count,Number of successful contacts made during the call,
five9_call_log_metrics_mapping,call_holds,Number of times the call was placed on hold,
five9_call_log_metrics_mapping,has_call_transfer,Boolean flag indicating if the call was transferred,
five9_call_log_metrics_mapping,is_call_answered,Boolean flag indicating if the call was answered by an agent,
five9_call_log_metrics_mapping,is_call_missed,Boolean flag indicating if the call was missed or not answered by an agent,
five9_call_log_metrics_mapping,is_call_abandoned,Boolean flag indicating if the call was abandoned by the caller,
five9_call_log_metrics_mapping,is_within_sla,Boolean flag indicating if the call was handled within the defined Service Level Agreement (SLA) time of 30 seconds,
five9_call_log_metrics_mapping,is_first_call_resolution,Boolean flag indicating if the call was resolved on the first contact without the need for follow-up,
five9_call_log_metrics_mapping,last_modified_ts,Timestamp when the record was last modified,
five9_call_log_metrics_mapping,_fivetran_synced_ts,Timestamp when the record was last synced by Fivetran,
email_campaign_mapping_dim,unique_key,Surrogate key for campaign_name,
email_campaign_mapping_dim,brand_name,Brand name (uppercase),
email_campaign_mapping_dim,campaign_name,Email campaign name,
email_campaign_mapping_dim,profession,Profession associated with the campaign,
email_campaign_mapping_dim,education_type,Education type for the campaign,
email_campaign_mapping_dim,region,Region for the campaign,
email_campaign_name_split_dim,spl_campaign_name,Original campaign name that was split,
email_campaign_name_split_dim,spl_executor_name,Executor component extracted from campaign name,
email_campaign_name_split_dim,spl_ecosystem_name,Ecosystem component extracted from campaign name,
email_campaign_name_split_dim,spl_brand_name,Brand component extracted from campaign name,
email_campaign_name_split_dim,spl_region_code,Region code component extracted from campaign name,
email_campaign_name_split_dim,spl_education_type,Education type component extracted from campaign name,
email_campaign_name_split_dim,spl_profession_name,Profession name component extracted from campaign name,
email_campaign_name_split_dim,spl_campaign_description,Campaign description component extracted from campaign name,
nursing_entity_blocking,unique_id,Surrogate key (entity_id from nursing_entity),
nursing_entity_blocking,brand_id,Identifier for the brand/subsidiary (NULL for prospects),
nursing_entity_blocking,brand_name,Name of the brand/subsidiary (NULL for prospects),
nursing_entity_blocking,customer_id,Original customer identifier from the source system (or synthetic ID from email hash),
nursing_entity_blocking,entity_type,Type of entity - 'customer' or 'license',
nursing_entity_blocking,email_block,Blocking key combining cleaned email and first name soundex,
nursing_entity_blocking,phone_block,Blocking key combining last 10 digits of phone and first name soundex,
nursing_entity_blocking,zip_fname_street_block,"Blocking key combining zipcode, first name soundex, and street number",
nursing_entity_blocking,zip_fname_lname_block,"Blocking key combining zipcode, first name, and last name",
