model,column,description,Ontology Definition
ctc_shopify_order_line_refund,_fivetran_synced_ts,The time at which fivetran last synced this record,
ctc_shopify_order_shipping_line,order_shipping_line_id,The unique identifier of the order shipping line,
ctc_shopify_order_shipping_line,order_id,The order id ,
ctc_shopify_order_shipping_line,discounted_price,The order shopping discounted price,
ctc_shopify_order_shipping_line,price,The order shopping price,
ctc_shopify_product,product_id,The unique identifier of the product,
ctc_shopify_product,updated_at,The order updated date,
ctc_shopify_product,created_at,The order created date,
ctc_shopify_product,title,Represents the title of the product,
ctc_shopify_product,product_type,Represents the product type,
ctc_shopify_product,status,Represents the product status,
ctc_shopify_product,_fivetran_synced_ts,The time at which fivetran last synced this record,
ctc_shopify_refund,refund_id,The unique identifier of the refund,
ctc_shopify_refund,order_id,The order id ,
ctc_shopify_refund,user_id,The refund user id ,
ctc_shopify_refund,created_at,The refund created date,
ctc_shopify_refund,processed_at,The refund processed date,
ctc_shopify_refund,_fivetran_synced_ts,The time at which fivetran last synced this record,
ctc_shopify_user,user_id,The unique identifier of the user,
ctc_shopify_user,email,Represents the email of the customer,
ctc_shopify_user,first_name,Represents the first name,
ctc_shopify_user,last_name,Represents the last name,
ctc_shopify_user,phone,Represents phone  of the customer,
ctc_shopify_user,_fivetran_synced_ts,The time at which fivetran last synced this record,
elitenp_klaviyo_event,event_id,Represents the event id,
elitenp_klaviyo_event,campaign_id,Represents the campaign id of event,
elitenp_klaviyo_event,flow_id,Represents the flow id of event,
elitenp_klaviyo_event,person_id,Represents the person id of event,
elitenp_klaviyo_event,campaign_name,Represents the campaign name,
elitenp_klaviyo_event,event_type,Represents the event type,
elitenp_klaviyo_event,created_ts,Represents the event created date,
elitenp_klaviyo_event,event_date,Represents the event date,
elitenp_klaviyo_event,email_subject,Represents the email subject,
elitenp_klaviyo_event,_fivetran_synced_ts,The time at which fivetran last synced this record,
elitenp_stripe_balance_transactions,balance_transaction_id,Unique balance transaction ID,
elitenp_stripe_balance_transactions,_fivetran_synced,Fivetran sync timestamp,
elitenp_stripe_customers,customer_id,Unique customer ID,
elitenp_stripe_customers,_fivetran_synced,Fivetran sync timestamp,
elitenp_stripe_refunds,refund_id,Unique refund ID,
elitenp_stripe_refunds,_fivetran_synced,Fivetran sync timestamp,
elitenp_teachable_transaction_created,transaction_id,Unique identifier for the transaction,
elitenp_teachable_transaction_created,_fivetran_synced_ts,Fivetran sync timestamp,
elitenp_teachable_transaction_created,transaction_status,Status of the transaction,
elitenp_teachable_transaction_created,currency,Currency code for the transaction,
elitenp_teachable_transaction_created,final_price,Final price of the transaction in cents,
elitenp_teachable_transaction_created,is_recurring,Whether the transaction is recurring,
elitenp_teachable_transaction_created,transactions_purchased_at,Timestamp when the transaction was purchased,
elitenp_teachable_transaction_created,created,Timestamp when the transaction record was created,
elitenp_teachable_transaction_created,transactions_earnings_usd,Transaction earnings in USD cents,
elitenp_teachable_transaction_created,net_revenue_usd,Net revenue in USD cents,
elitenp_teachable_transaction_created,transactions_net_charge,Net charge for the transaction in cents,
elitenp_teachable_transaction_created,transactions_net_charge_usd,Net charge for the transaction in USD cents,
elitenp_teachable_transaction_created,transactions_marketplace_affiliate_fees,Marketplace affiliate fees in cents,
elitenp_teachable_transaction_created,author_fees,Author fees in cents,
elitenp_teachable_transaction_created,processor_fee,Payment processor fee in cents,
elitenp_teachable_transaction_created,amount_refunded,Amount refunded in cents,
elitenp_teachable_transaction_created,transactions_vat_fees,VAT fees in cents,
elitenp_teachable_transaction_created,fedora_fee,Fedora fee in cents,
elitenp_teachable_transaction_created,total_fedora_fee,Total Fedora fee in cents,
elitenp_teachable_transaction_created,affiliate_percent,Affiliate percentage as decimal,
elitenp_teachable_transaction_created,author_percent,Author percentage as decimal,
elitenp_teachable_transaction_created,fedora_percent,Fedora percentage as decimal,
elitenp_teachable_transaction_created,transactions_is_chargeback,Whether the transaction is a chargeback,
elitenp_teachable_transaction_created,coupon_code,Coupon ID used in the transaction,
elitenp_teachable_transaction_created,transactions_sale_id,Sale ID associated with the transaction,
elitenp_teachable_transaction_created,transactions_final_price,Final price of the transaction in cents (duplicate field),
elitenp_teachable_transaction_created,transactions_currency,Currency code for the transaction (duplicate field),
elitenp_teachable_transaction_created,transactions_coupon_id,Coupon ID used in the transaction (duplicate field),
elitenp_teachable_transaction_created,transactions_is_recurring,Whether the transaction is recurring (duplicate field),
elitenp_teachable_transaction_created,coupon_name,Name of the coupon used (currently null),
elitenp_teachable_transaction_created,customer_name,Name of the customer,
elitenp_teachable_transaction_created,customer_email,Email address of the customer,
elitenp_teachable_transaction_created,shipping_address_line1,First line of shipping address,
elitenp_teachable_transaction_created,shipping_address_line2,Second line of shipping address,
elitenp_teachable_transaction_created,shipping_address_state_code,State/region code for shipping address,
elitenp_teachable_transaction_created,shipping_address_country_code,Country code for shipping address,
elitenp_teachable_transaction_created,price,Sale price in cents,
elitenp_teachable_transaction_created,is_active,Whether the sale is active,
elitenp_teachable_transaction_created,course_id,ID of the course associated with the sale,
elitenp_teachable_transaction_created,course_name,Name of the course,
elitenp_teachable_transaction_created,product_id,ID of the product,
elitenp_teachable_transaction_created,is_subscription,Whether the product is a subscription,
elitenp_teachable_transaction_created,product_price,Price of the product in cents,
elitenp_teachable_transaction_created,product_name,Name of the product,
elitenp_teachable_transaction_created,transactions_created_at,Timestamp when the transaction was created,
elitenp_teachable_transaction_created,item_name,Name of the purchased item,
elitenp_teachable_transaction_created,item_id,ID of the purchased item,
elitenp_teachable_transaction_created,item_type,Type of the purchased item,
elitenp_teachable_transaction_created,transactions_refundable,Whether the transaction is refundable,
elitenp_teachable_transaction_created,transactions_net_tax_charge,Net tax charge in cents,
elitenp_teachable_transaction_created,transactions_original_product_charge_usd,Original product charge in USD cents,
elitenp_teachable_transaction_created,transactions_net_product_charge_usd,Net product charge in USD cents,
elitenp_teachable_transaction_created,transactions_marketplace_affiliate_id,Marketplace affiliate ID,
elitenp_teachable_transaction_created,transactions_marketplace_teachable_fees,Marketplace Teachable fees in cents,
elitenp_teachable_transaction_created,transactions_teachable_generated_lead_fee_percent,Teachable generated lead fee percentage,
elitenp_teachable_transaction_created,transactions_chargeback_fee,Chargeback fee in cents,
elitenp_teachable_transaction_created,transactions_fee_details_base,Base fee details,
elitenp_teachable_transaction_created,transactions_fee_details_rate,Fee rate details,
elitenp_teachable_transaction_created,transactions_fee_details_cross_border,Cross border fee details,
elitenp_teachable_transaction_created,transactions_fee_details_payment_method,Payment method fee details,
elitenp_teachable_transaction_created,transactions_fee_details_cross_border_assessed,Cross border assessed fee details,
elite_hubspot_company,company_id,"The unique, system-generated ID assigned during creation",
elite_hubspot_company,_fivetran_synced_ts,The time at which fivetran last synced this record,
elite_hubspot_deal,deal_id,Represents the id of the deal,
elite_hubspot_deal,_fivetran_synced_ts,The time at which fivetran last synced this record,
elite_hubspot_deal_company,company_id,Represents the id of the company,
elite_hubspot_deal_company,deal_id,Represents the id of the deal,
elite_hubspot_deal_company,_fivetran_synced_ts,The time at which fivetran last synced this record,
elite_hubspot_deal_pipeline_stage,stage_id,"The unique, system-generated ID assigned during creation",
elite_hubspot_deal_pipeline_stage,_fivetran_synced_ts,The time at which fivetran last synced this record,
elite_hubspot_email_campaign,campaign_id,Represents the id of the email campaign,
elite_hubspot_email_campaign,campaign_name,Represents the name of the email campaign,
elite_hubspot_email_campaign,campaign_type,Represents the type of the email campaign,
elite_hubspot_email_campaign,email_subject,Represents the subject of the email,
elite_hubspot_email_campaign,email_type,Represents a custom type of the email campaign,
elite_hubspot_email_campaign,app_name,Represents the name of the email campaign,
elite_hubspot_email_event,event_id,Represents the id of the event,
elite_hubspot_email_event,recipient_email,Represents the recipient email of the event,
elite_hubspot_email_event,campaign_id,Represents the id of the campaign,
elite_hubspot_email_event,event_type,Represents the type of the event,
elite_hubspot_email_event,sent_ts,The time of the related send event,
elite_hubspot_email_event,event_ts,Represents the time of the event creation,
elite_hubspot_email_subscription_change,event_id,Represents the id of the event that caused the change,
elite_hubspot_email_subscription_change,event_type,Represents a custom type of the event,
elite_hubspot_email_subscription_change,subscription_name,The name of the subscription,
elite_hubspot_marketing_email,marketing_email_id,Represents the id of the marketing marketing email,
elite_hubspot_marketing_email,marketing_email_name,"Represents the name of the marketing email, e.g. 'MARCH NEWSLETTER'",
elite_hubspot_marketing_email,email_type,"Represents the type of the marketing email, e.g. 'FOLLOWUP_EMAIL' or 'AB_EMAIL'",
elite_hubspot_marketing_email,ab_variation,Returns true for A/B pages that render the B variation,
elite_hubspot_marketing_email,campaign_name,Represents the name of the marketing campaign,
elite_hubspot_marketing_email,subject,"Represents the subject of the marketing email, e.g. 'STC Giftmas Day 7 - Win a 60-minute tutoring session!'",
elite_hubspot_marketing_email,_fivetran_synced_ts,The time at which fivetran last synced this record,
elite_hubspot_marketing_email_campaign,campaign_id,Represents the id of the email campaign,
elite_hubspot_marketing_email_campaign,marketing_email_id,Represents the id of the marketing marketing email,
elite_hubspot_marketing_email_campaign,_fivetran_synced_ts,The time at which fivetran last synced this record,
elite_hubspot_owner,owner_id,Represents the id of the owner,
elite_hubspot_owner,_fivetran_synced_ts,The time at which fivetran last synced this record,
elite_hubspot_owner_team,owner_id,Represents the id of the owner,
elite_hubspot_owner_team,team_id,Represents the id of the team,
elite_hubspot_owner_team,_fivetran_synced_ts,The time at which fivetran last synced this record,
elite_hubspot_team,team_id,Represents the id of the team,
elite_hubspot_team,team_name,Represents the name of the team,
elite_hubspot_team,_fivetran_synced_ts,The time at which fivetran last synced this record,
email_campaign_mapping,brand_name,Brand name,
email_campaign_mapping,campaign_name,Email campaign name,
email_campaign_mapping,profession,Profession associated with the campaign,
email_campaign_mapping,education_type,Education type for the campaign,
email_campaign_mapping,region,Region for the campaign,
facebook_ads_account_history,_fivetran_id,The unique key.,
facebook_ads_account_history,account_id,The ID of the ad account.,
facebook_ads_account_history,account_name,Name of the account.,
facebook_ads_account_history,is_latest,Boolean representing whether a record is the most recent version of that record. All records should have this value set to True given we filter on it.,
facebook_ads_account_history,created_ts,The time account was created.,
facebook_ads_account_history,_fivetran_synced_ts,The time at which fivetran last synced this record,
facebook_ads_ad_history,unique_id,Primary Key,
facebook_ads_ad_history,ad_id,The ID of this ad.,
facebook_ads_ad_history,account_id,The ID of the ad account.,
facebook_ads_ad_history,ad_set_id,ID of the ad set that contains the ad.,
facebook_ads_ad_history,campaign_id,Ad campaign that contains this ad.,
facebook_ads_ad_history,creative_id,The ID of the ad creative to be used by this ad.,
facebook_ads_ad_history,ad_name,Name of the ad.,
facebook_ads_ad_history,is_latest,Boolean representing whether a record is the most recent version of that record. All records should have this value set to True given we filter on it.,
facebook_ads_ad_history,updated_at,The timestamp of the last update of a record.,
facebook_ads_ad_history,_fivetran_synced_ts,The time at which fivetran last synced this record,
facebook_ads_basic_ad,unique_id,Primary Key,
facebook_ads_basic_ad,ad_id,The ID of this ad.,
facebook_ads_basic_ad,account_id,The ID of the ad account that this ad belongs to.,
facebook_ads_basic_ad,ad_name,Name of the ad.,
facebook_ads_basic_ad,ad_set_name,Name of the ad set the report relates to.,
facebook_ads_basic_ad,date,The date of the reported performance.,
facebook_ads_basic_ad,clicks,The number of clicks the ad had on the given day.,
facebook_ads_basic_ad,impressions,The number of impressions the ad had on the given day.,
facebook_ads_basic_ad,spend,The spend on the ad in the given day.,
facebook_ads_campaign_history,unique_id,Primary Key,
facebook_ads_campaign_history,campaign_id,The ID of the campaign.,
facebook_ads_campaign_history,account_id,The ID of the ad account that this campaign belongs to.,
facebook_ads_campaign_history,campaign_name,The name of the campaign.,
facebook_ads_campaign_history,status,"Status values are - 'ACTIVE', 'PAUSED', 'DELETED', 'ARCHIVED'.",
facebook_ads_campaign_history,is_latest,Boolean representing whether a record is the most recent version of that record. All records should have this value set to True given we filter on it.,
facebook_ads_campaign_history,start_at,Timestamp of designated campaign start time.,
facebook_ads_campaign_history,end_at,Timestamp of designated campaign end time.,
facebook_ads_campaign_history,updated_at,The timestamp of the last update of a record.,
facebook_ads_campaign_history,created_at,The time the campaign was created.,
facebook_ads_campaign_revenue_by_day_1_day_attribution_actions,unique_id,Primary Key,
facebook_ads_campaign_revenue_by_day_1_day_attribution_actions,campaign_id,The campaign id from the campaign,
facebook_ads_campaign_revenue_by_day_1_day_attribution_actions,action_type,The type of action,
facebook_ads_campaign_revenue_by_day_1_day_attribution_actions,view_conversions_1d,The number of conversions that is associated with a campaign.,
facebook_ads_campaign_revenue_by_day_1_day_attribution_actions,date,The date of the campaign,
facebook_ads_campaign_revenue_by_day_1_day_attribution_actions,_fivetran_synced_ts,The time at which fivetran last synced this record,
facebook_ads_campaign_revenue_by_day_1_day_attribution_action_values,unique_id,Primary Key,
facebook_ads_campaign_revenue_by_day_1_day_attribution_action_values,campaign_id,The campaign id for the campaign,
facebook_ads_campaign_revenue_by_day_1_day_attribution_action_values,action_type,The type of action,
facebook_ads_campaign_revenue_by_day_1_day_attribution_action_values,view_revenue_1d,The revenue associated to the campaign and is in USD currency.,
facebook_ads_campaign_revenue_by_day_1_day_attribution_action_values,date,The date of the campaign,
facebook_ads_campaign_revenue_by_day_1_day_attribution_action_values,_fivetran_synced_ts,The time at which fivetran last synced this record,
facebook_ads_campaign_revenue_by_day_28_day_attribution_actions,unique_id,Primary Key,
facebook_ads_campaign_revenue_by_day_28_day_attribution_actions,campaign_id,The campaign id from the campaign,
facebook_ads_campaign_revenue_by_day_28_day_attribution_actions,action_type,The type of action,
facebook_ads_campaign_revenue_by_day_28_day_attribution_actions,view_conversions_28d,The number of conversions that is associated with a campaign.,
facebook_ads_campaign_revenue_by_day_28_day_attribution_actions,date,The date of the campaign,
facebook_ads_campaign_revenue_by_day_28_day_attribution_actions,_fivetran_synced_ts,The time at which fivetran last synced this record,
facebook_ads_campaign_revenue_by_day_28_day_attribution_action_values,unique_id,Primary Key,
facebook_ads_campaign_revenue_by_day_28_day_attribution_action_values,campaign_id,The campaign id for the campaign,
facebook_ads_campaign_revenue_by_day_28_day_attribution_action_values,action_type,The type of action,
facebook_ads_campaign_revenue_by_day_28_day_attribution_action_values,view_revenue_28d,The revenue associated to the campaign and is in USD currency.,
facebook_ads_campaign_revenue_by_day_28_day_attribution_action_values,date,The date of the campaign,
facebook_ads_campaign_revenue_by_day_28_day_attribution_action_values,_fivetran_synced_ts,The time at which fivetran last synced this record,
facebook_ads_campaign_revenue_by_day_7_day_attribution_actions,unique_id,Primary Key,
facebook_ads_campaign_revenue_by_day_7_day_attribution_actions,campaign_id,The campaign id from the campaign,
facebook_ads_campaign_revenue_by_day_7_day_attribution_actions,action_type,The type of action,
facebook_ads_campaign_revenue_by_day_7_day_attribution_actions,view_conversions_7d,The number of conversions that is associated with a campaign.,
facebook_ads_campaign_revenue_by_day_7_day_attribution_actions,date,The date of the campaign,
facebook_ads_campaign_revenue_by_day_7_day_attribution_actions,_fivetran_synced_ts,The time at which fivetran last synced this record,
facebook_ads_campaign_revenue_by_day_7_day_attribution_action_values,unique_id,Primary Key,
facebook_ads_campaign_revenue_by_day_7_day_attribution_action_values,campaign_id,The campaign id for the campaign,
facebook_ads_campaign_revenue_by_day_7_day_attribution_action_values,action_type,The type of action,
facebook_ads_campaign_revenue_by_day_7_day_attribution_action_values,view_revenue_7d,The revenue associated to the campaign and is in USD currency.,
facebook_ads_campaign_revenue_by_day_7_day_attribution_action_values,date,The date of the campaign,
facebook_ads_campaign_revenue_by_day_7_day_attribution_action_values,_fivetran_synced_ts,The time at which fivetran last synced this record,
facebook_ads_campaign_revenue_by_day_actions,unique_id,Primary Key,
facebook_ads_campaign_revenue_by_day_actions,campaign_id,The campaign id from the campaign,
facebook_ads_campaign_revenue_by_day_actions,action_type,The type of action,
facebook_ads_campaign_revenue_by_day_actions,conversions,The number of conversions that is associated with a campaign.,
facebook_ads_campaign_revenue_by_day_actions,date,The date of the campaign,
facebook_ads_campaign_revenue_by_day_actions,_fivetran_synced_ts,The time at which fivetran last synced this record,
facebook_ads_campaign_revenue_by_day_action_values,unique_id,Primary Key,
facebook_ads_campaign_revenue_by_day_action_values,campaign_id,The campaign id for the campaign,
facebook_ads_campaign_revenue_by_day_action_values,action_type,The type of action,
facebook_ads_campaign_revenue_by_day_action_values,revenue,The revenue associated to the campaign and is in USD currency.,
facebook_ads_campaign_revenue_by_day_action_values,date,The date of the campaign,
facebook_ads_campaign_revenue_by_day_action_values,_fivetran_synced_ts,The time at which fivetran last synced this record,
fhea_sales_customer,customer_id,The system generated unique ID for each customer,
fhea_sales_customer,email,The email address for the customer,
fhea_sales_customer,_fivetran_synced_ts,The time at which fivetran last synced this record,
fhea_sales_history,unique_id,Unique identifier for each transaction,
fhea_sales_history,transaction_id,The system generated ID for each transaction,
fhea_sales_history,transaction_line_id,The system generated ID for each transaction line,
fhea_sales_history,customer_id,The system generated unique ID for each customer,
fhea_sales_history,quantity,The quantity for the transaction,
fhea_sales_history,net_amount,The net price for the transaction,
fhea_sales_history,_fivetran_synced_ts,The time at which fivetran last synced this record,
five9_acd_data_import,call_id,Unique identifier for the call,
five9_acd_data_import,campaign_type,Type of campaign associated with the call,
five9_acd_data_import,call_type,Classification of the call type,
five9_acd_data_import,media_type,"Media type used for the call (voice, chat, etc.)",
five9_acd_data_import,disposition,Final disposition or outcome of the call,
five9_acd_data_import,extension,Phone extension used,
five9_acd_data_import,calls,Number of calls,
five9_acd_data_import,first_call_resolution,"First call resolution metric, null values converted to 0",
five9_acd_data_import,speed_of_answer_seconds,Speed of answer converted to seconds,
five9_acd_data_import,conference_time_seconds,Conference time converted to seconds,
five9_acd_data_import,_fivetran_synced_ts,Fivetran synchronization timestamp,
five9_acd_data_import,last_modified_ts,Last modification timestamp,
five9_acd_data_import,file_line_number,Line number in the source file,
five9_acd_data_import,file_name,Name of the source file,
five9_acd_queue_agent_campaign_skill,call_id,Unique identifier for each call in the Five9 system,
five9_acd_queue_agent_campaign_skill,call_day_of_week,The day of week when the call occurred,
five9_acd_queue_agent_campaign_skill,call_ts,The timestamp when the call occurred,
five9_acd_queue_agent_campaign_skill,agent_name,The name of the Five9 agent who handled the call,
five9_acd_queue_agent_campaign_skill,brand_campaign,The specific brand that the agent was supporting during this call interaction.,
five9_acd_queue_agent_campaign_skill,skill,"The specific skill or skill group that was required or used for handling the call. Five9 uses skills-based routing to match callers with appropriately skilled agents.
",
five9_acd_queue_agent_campaign_skill,last_modified_ts,Timestamp indicating when the record was last modified in the source system,
five9_acd_queue_agent_campaign_skill,_fivetran_synced_ts,Timestamp showing when this data was last synced by Fivetran into the data warehouse,
five9_acd_queue_agent_campaign_skill,file_name,Name of the source file from which this record was loaded,
five9_acd_queue_agent_campaign_skill,file_line_number,Line number in the source file corresponding to this record,
five9_agent_data_import,agent_id,Unique identifier for the agent,
five9_agent_data_import,agent_name,Full name of the agent,
five9_agent_data_import,agent,Agent username or identifier,
five9_agent_data_import,agent_email,Email address of the agent,
five9_agent_data_import,agent_skill,Skill assigned to the agent,
five9_agent_data_import,agent_group,Group the agent belongs to,
five9_agent_data_import,ani,Automatic Number Identification,
five9_agent_data_import,extension,Agent's phone extension,
five9_agent_data_import,call_id,Unique identifier for the call,
five9_agent_data_import,call_type,"Type of call (inbound, outbound, etc.)",
five9_agent_data_import,campaign,Campaign associated with the call,
five9_agent_data_import,campaign_type,Type of campaign,
five9_agent_data_import,dnis,Dialed Number Identification Service,
five9_agent_data_import,disposition,Call disposition or outcome,
five9_agent_data_import,agent_disconnects_first,Flag indicating if agent disconnected first (0 or 1),
five9_agent_data_import,reason_code,Reason code for the call disposition,
five9_agent_data_import,agent_state,Current state of the agent,
five9_agent_data_import,_fivetran_synced_ts,Timestamp when record was synced by Fivetran,
five9_agent_data_import,last_modified_ts,Timestamp when record was last modified,
five9_call_log_metrics,call_id,Unique identifier for each call in the Five9 system,
five9_call_log_metrics,call_date,Date when the call occurred,
five9_call_log_metrics,after_call_work_time_seconds,Time spent by agents completing post-call tasks (in seconds),
five9_call_log_metrics,call_billed_time_seconds,"Total billable time for the call, rounded according to Five9 billing rules",
five9_call_log_metrics,call_time_seconds,Total duration of the call from start to finish,
five9_call_log_metrics,handle_time_seconds,Total time spent handling the call (talk time + hold time + after call work),
five9_call_log_metrics,ring_time_seconds,Time the call spent ringing before being answered,
five9_call_log_metrics,talk_time_seconds,Time spent with the agent and caller in active conversation,
