model,column,description,Ontology Definition
transaction_line_fact_closedbooktest,header_24,Place holder for visibility when reviewing table. Highlights/seprates the columns that are for 2024,
transaction_line_fact_closedbooktest,cbtotal_2024,cb/seed total by brand for 2024,
transaction_line_fact_closedbooktest,cr_total_2024,cr total by brand for 2024,
transaction_line_fact_closedbooktest,cbto_diff_sum_2024,cr total - cb total by brand for 2024,
transaction_line_fact_closedbooktest,cbto_diff_percent_2024,cbt diff sum / cb total. Will be tested for amount difference within 2% diff of closed book total,
transaction_line_fact_closedrevenuetotals,brand_id,Netsuite id for Subsidary / Brand,
transaction_line_fact_closedrevenuetotals,brand_name,Netsuite full name of the Subsidary / brand,
transaction_line_fact_closedrevenuetotals,tranyear,transaction_ts converted to year (char) and prefixed with a column header of cr_total_. Data later pivoted,
transaction_line_fact_closedrevenuetotals,netamount,Sum of net amount from transaction_line_fact by year and brand. Pivoted to cr_total_XXXX column upstream,
transaction_membership_fact,unique_id,Surrogate key uniquely identifying each transaction line item,
transaction_membership_fact,transaction_id,Unique identifier for each transaction,
transaction_membership_fact,transaction_line_id,Unique identifier for each transaction line item,
transaction_membership_fact,customer_id,Unique identifier for the customer,
transaction_membership_fact,membership_start_date,Date when the membership period begins,
transaction_membership_fact,transaction_date,Date and time when the transaction occurred,
transaction_membership_fact,transaction_type,Type of transaction (Invoice or Credit Memo),
transaction_membership_fact,course_id,Identifier for the course associated with the membership,
transaction_membership_fact,product_id,Identifier for the membership product,
transaction_membership_fact,net_amount,Net transaction amount,
transaction_membership_fact,created_from_transaction_id,Original transaction ID if this is a credit memo or related transaction,
transaction_membership_fact,profession_id,Identifier for the profession,
transaction_membership_fact,education_type_id,Identifier for the type of education,
transaction_membership_fact,profession_education_type,Concatenated profession and education type name,
transaction_membership_fact,product_group,Product grouping category,
transaction_membership_fact,state_id,State identifier for the customer,
transaction_membership_fact,completion_status_id,Identifier for the completion status,
transaction_membership_fact,brand_id,Brand identifier for the membership,
transaction_membership_fact,source_name,Source system or channel name,
transaction_membership_fact,booking_type,"How the membership was booked (New Order, Renewal, Reinstatement)",
transaction_membership_fact,membership_package_type,"Type/tier of membership package (Plus, Pro, Premier, or tier names)",
transaction_membership_fact,membership_hierarchy,"Numeric ranking of membership tier (1=highest, 4=lowest)",
transaction_membership_fact,membership_length_months,Duration of membership in months,
transaction_membership_fact,flex_flag,"Flag indicating if membership is flex type (1=yes, 0=no)",
transaction_membership_fact,build_your_own_flag,"Flag indicating if membership is build-your-own type (1=yes, 0=no)",
transaction_membership_fact,program_flag,"Flag indicating if membership is program type (1=yes, 0=no)",
transaction_membership_fact,invoice_subscription_number,Sequential invoice number for customer's subscription history (includes refunds),
transaction_membership_fact,membership_end_date,Calculated end date of membership period based on length,
transaction_membership_fact,credit_memo_date,Date when credit memo was issued (for refunds),
transaction_membership_fact,credit_memo_amount,Amount of the credit memo (for refunds),
transaction_membership_fact,days_from_membership_start_date_to_credit_memo_date,Days between membership start and refund,
transaction_membership_fact,sale_indicator,Whether transaction is a sale or refund,
transaction_membership_fact,merged_membership_end_date,Actual membership end date (either calculated end or refund date),
transaction_membership_fact,sale_invoice_subscription_number,Sequential subscription number excluding refunded invoices,
transaction_membership_fact,prior_membership_hierarchy,Membership tier of previous subscription in sequence,
transaction_membership_fact,prior_sale_indicator,Sale/refund indicator of previous subscription,
transaction_membership_fact,prior_membership_end_date,End date of previous membership period,
transaction_membership_fact,prior_membership_package_type,Package type of previous membership,
transaction_membership_fact,prior_membership_length_months,Length in months of previous membership,
transaction_membership_fact,dd_membership_start_date_to_prior_membership_end_date,Days between current membership start and prior membership end,
transaction_membership_fact,next_booking_type,Booking type of next subscription in sequence,
transaction_membership_fact,next_membership_hierarchy,Membership tier of next subscription,
transaction_membership_fact,next_membership_package_type,Package type of next subscription,
transaction_membership_fact,next_membership_length_months,Length in months of next subscription,
transaction_membership_fact,churn_indicator,Whether customer churned after this membership period,
transaction_membership_fact,next_membership_start_date,Start date of next membership period,
transaction_membership_fact,active_next_membership_start_date,Start date of next membership (null if refunded on day 0),
transaction_membership_fact,dd_membership_end_date_to_next_membership_start_date,Days between current membership end and next membership start,
transaction_membership_fact,start_date_segment,Categorization of how this membership period started,
transaction_membership_fact,end_date_segment,Categorization of how this membership period ended,
transaction_membership_fact,membership_package_change,Whether customer upgraded or downgraded from previous membership,
transaction_membership_fact,payment_term,"Sequential payment term number by customer, state, and profession",
wbr_sales_metrics,key,Surrogate key for one WBR record at dimension + period grain.,
wbr_sales_metrics,metric_domain,Metric domain label used by the shared WBR framework.,
wbr_sales_metrics,dim_education_type,Education type dimension.,
wbr_sales_metrics,dim_brand_name,Brand dimension.,
wbr_sales_metrics,dim_customer_type,Customer type dimension.,
wbr_sales_metrics,dim_ecosystem_name,Ecosystem dimension.,
wbr_sales_metrics,dim_profession_name,Profession dimension.,
wbr_sales_metrics,dim_enrolled_by_team,Team responsible for enrollment.,
wbr_sales_metrics,dim_transaction_type,Transaction type dimension.,
wbr_sales_metrics,dim_purchase_type,Purchase type dimension.,
wbr_sales_metrics,period_start_date,Start date of the reporting bucket based on date_agg.,
wbr_sales_metrics,date_agg,Reporting grain for the row.,
wbr_sales_metrics,net_amount_sum,Current-period net amount.,
wbr_sales_metrics,yoy_net_amount_sum,1-year comparator net amount at the same grain and dimensions.,
wbr_sales_metrics,yoy_2y_net_amount_sum,2-year comparator net amount at the same grain and dimensions.,
wbr_sales_metrics,order_count,Current-period distinct order count.,
wbr_sales_metrics,yoy_order_count,1-year comparator distinct order count.,
wbr_sales_metrics,yoy_2y_order_count,2-year comparator distinct order count.,
wbr_sales_metrics,customer_count,Current-period distinct customer count.,
wbr_sales_metrics,yoy_customer_count,1-year comparator distinct customer count.,
wbr_sales_metrics,yoy_2y_customer_count,2-year comparator distinct customer count.,
wbr_sales_metrics,current_period_flag,Flag indicating the current open period for each grain.,
activities_8x8,id,Unique identifier for the activity record,
activities_8x8,interaction_id,Foreign key linking to the parent interaction/call. Maps to 8x8 interactionid field,
activities_8x8,channel_id,"Identifier for the communication channel used (e.g., voice, chat, email)",
activities_8x8,group_name,Name of the agent group or team handling the activity,
activities_8x8,media_type,"Type of media for the interaction (e.g., Voice, Chat, Email)",
activities_8x8,agent_id,Unique identifier for the agent involved in the activity,
activities_8x8,agent_name,Full name of the agent handling the activity,
activities_8x8,queue_name,Name of the queue from which the interaction was handled,
activities_8x8,group_id,Unique identifier for the agent group or department,
activities_8x8,transaction_id,Identifier for the specific transaction within the interaction,
activities_8x8,record_number,Sequential record number for the transaction (transrecnum),
activities_8x8,transaction_total_time,Total time spent on the transaction in seconds,
activities_8x8,transaction_process_time,Time spent actively processing the transaction in seconds,
activities_8x8,transaction_post_process_time,Time spent on post-processing activities after the transaction in seconds,
activities_8x8,transfer_from,Source agent or system from which the transaction was transferred,
activities_8x8,conference_from,Source agent or system from which the transaction was conferenced,
activities_8x8,queue_object_id,Internal object identifier for the queue,
activities_8x8,channel_object_id,Internal object identifier for the channel,
activities_8x8,accept_time,Timestamp when the transaction was accepted by the agent,
activities_8x8,load_date,Date when the record was loaded into the 8x8 system,
activities_8x8,_fivetran_synced_ts,Timestamp when the record was last synced by Fivetran,
agents_8x8,id,Unique identifier for the agent record,
agents_8x8,agent_id,"8x8 system agent identifier, used for linking to interactions and activities",
agents_8x8,group_id,Identifier for the agent group or department the agent belongs to,
agents_8x8,first_name,Agent's first name,
agents_8x8,last_name,Agent's last name,
agents_8x8,full_name,Agent's complete full name,
agents_8x8,email_address,Agent's email address for system communications,
agents_8x8,user_rights,System permissions and access rights assigned to the agent,
agents_8x8,enabled,Indicates if the agent account is active and enabled,
agents_8x8,workplace_sip,SIP (Session Initiation Protocol) address for the agent's workplace phone,
agents_8x8,login_id,System login identifier for the agent,
agents_8x8,max_concurrent_customer_chat,Maximum number of concurrent chat sessions the agent can handle,
agents_8x8,load_date,Date when the agent record was loaded into the 8x8 system,
agents_8x8,phone_used,Phone number or device identifier used by the agent,
agents_8x8,direct_agent_access,Indicates if the agent has direct access capabilities,
agents_8x8,voicemail_activated,Indicates if voicemail is activated for the agent,
agents_8x8,agent_to_agent_chat_disabled,Indicates if agent-to-agent chat is disabled,
agents_8x8,workplace_phone,Workplace phone number assigned to the agent,
agents_8x8,deleted,Boolean flag indicating if the agent record has been marked as deleted,
agents_8x8,_fivetran_synced_ts,Timestamp when the record was last synced by Fivetran,
channels_8x8,id,Unique identifier for the channel record,
channels_8x8,channel_id,"8x8 system channel identifier, used for linking interactions and routing configurations",
channels_8x8,channel_name,Name of the communication channel,
channels_8x8,channel_description,Detailed description of the channel's purpose and configuration,
channels_8x8,load_date,Date when the channel record was loaded into the 8x8 system,
channels_8x8,_fivetran_synced_ts,Timestamp when the record was last synced by Fivetran,
detailed_reports_interaction_details_8x8,id,Unique identifier for the record,
detailed_reports_interaction_details_8x8,call_id,Unique identifier for the call interaction,
detailed_reports_interaction_details_8x8,interaction_id,Transaction ID for the interaction,
detailed_reports_interaction_details_8x8,agent_name,Name of the agent handling the call,
detailed_reports_interaction_details_8x8,agent_id,Unique identifier for the agent,
detailed_reports_interaction_details_8x8,agent_type,"Type of participant (agent, customer, etc.)",
detailed_reports_interaction_details_8x8,customer_name,Name of the customer,
detailed_reports_interaction_details_8x8,media_type,Indicates if the interaction type was a phone call or voicemail,
detailed_reports_interaction_details_8x8,call_direction,Direction of the call (inbound/outbound),
detailed_reports_interaction_details_8x8,channel_id,Channel identifier for the call,
detailed_reports_interaction_details_8x8,queue_id,Unique identifier for the queue,
detailed_reports_interaction_details_8x8,skill,Queue name/skill for the call,
detailed_reports_interaction_details_8x8,queue_time,Time the call was queued,
detailed_reports_interaction_details_8x8,original_call_id,Original call ID if call was transferred,
detailed_reports_interaction_details_8x8,original_transaction_id,Original transaction ID if call was transferred,
detailed_reports_interaction_details_8x8,created_ts,Timestamp when the interaction was created,
detailed_reports_interaction_details_8x8,call_date,Date of the call,
detailed_reports_interaction_details_8x8,call_ts,Timestamp of the call,
detailed_reports_interaction_details_8x8,call_holds,Number of holds during the call,
detailed_reports_interaction_details_8x8,call_time_seconds,Total call processing duration in seconds,
detailed_reports_interaction_details_8x8,handle_time_seconds,Call handling duration in seconds,
detailed_reports_interaction_details_8x8,hold_time_seconds,Total hold duration in seconds,
detailed_reports_interaction_details_8x8,ivr_time_seconds,IVR treatment duration in seconds,
detailed_reports_interaction_details_8x8,offer_duration_seconds,Offer duration in seconds,
detailed_reports_interaction_details_8x8,queue_wait_time_seconds,Queue wait duration in seconds,
detailed_reports_interaction_details_8x8,after_call_work_time_seconds,After call work duration in seconds,
detailed_reports_interaction_details_8x8,busy_duration_seconds,Busy duration in seconds,
detailed_reports_interaction_details_8x8,caller_phone_number,Caller phone number,
detailed_reports_interaction_details_8x8,offer_action,Action taken on the offer,
detailed_reports_interaction_details_8x8,offer_ts,Timestamp when offer was made,
detailed_reports_interaction_details_8x8,offer_action_ts,Timestamp when offer action was taken,
detailed_reports_interaction_details_8x8,call_end_ts,Timestamp when call handling ended,
detailed_reports_interaction_details_8x8,finished_ts,Timestamp when call was finished,
detailed_reports_interaction_details_8x8,wrap_up_end_ts,Timestamp when wrap up ended,
detailed_reports_interaction_details_8x8,_fivetran_synced_ts,Timestamp when record was synced by Fivetran,
groups_8x8,id,Unique identifier for the group record,
groups_8x8,group_id,"8x8 system group identifier, used for linking agents and routing configurations",
groups_8x8,group_name,Name of the agent group or department,
groups_8x8,deleted,Boolean flag indicating if the group record has been marked as deleted,
groups_8x8,load_date,Date when the group record was loaded into the 8x8 system,
groups_8x8,_fivetran_synced_ts,Timestamp when the record was last synced by Fivetran,
becker_cpe_account,account_id,"The unique, system-generated ID assigned during creation",
becker_cpe_account,_fivetran_synced_ts,The time at which fivetran last synced this record,
becker_cpe_program,program_id,"The unique, system-generated ID assigned during creation",
becker_cpe_program,_fivetran_synced_ts,The time at which fivetran last synced this record,
becker_cpe_program_session,program_session_id,"The unique, system-generated ID assigned during creation",
becker_cpe_program_session,_fivetran_synced_ts,The time at which fivetran last synced this record,
becker_cpe_program_session_account_time_tracking,program_session_account_id,Reference to enrollment,
becker_cpe_program_session_account_time_tracking,_fivetran_synced_ts,The time at which fivetran last synced this record,
becker_cpe_program_session_slide_track,program_session_account_id,Reference to enrollment,
becker_cpe_program_session_slide_track,_fivetran_synced_ts,The time at which fivetran last synced this record,
becker_cpe_program_session_track,program_session_account_id,Reference to enrollment,
becker_cpe_program_session_track,_fivetran_synced_ts,The time at which fivetran last synced this record,
becker_cpe_quiz,quiz_id,"The unique, system-generated ID assigned during creation",
becker_cpe_quiz,_fivetran_synced_ts,The time at which fivetran last synced this record,
becker_cpe_quiz_account,id,"The unique, system-generated ID assigned during creation",
becker_cpe_quiz_account,_fivetran_synced_ts,The time at which fivetran last synced this record,
csv_becker_transactions,unique_id,Unique identifier for each transaction,
csv_becker_transactions,transaction_id,Unique identifier for each transaction,
csv_becker_transactions,transaction_line_id,Sequential number within each transaction group,
csv_becker_transactions,trandate,Transaction date,
csv_becker_transactions,subsidiary_id,ID of the subsidiary,
csv_becker_transactions,profession_id,ID of the profession,
csv_becker_transactions,education_type_id,ID of the education type,
csv_becker_transactions,customer_type,Type of customer,
csv_becker_transactions,amount,Transaction amount,
csv_becker_transactions,delivery_method_id,ID of the delivery method,
csv_becker_transactions,state_id,ID of the state,
csv_becker_transactions,transaction_type,Type of transaction,
csv_becker_transactions,source_name,Name of the source,
becker_eloqua_account,account_id,"The unique, system-generated ID assigned during creation",
becker_eloqua_account,_fivetran_synced_ts,The time at which fivetran last synced this record,
becker_eloqua_campaign,campaign_id,"The unique, system-generated ID assigned during creation",
becker_eloqua_campaign,_fivetran_synced_ts,The time at which fivetran last synced this record,
becker_eloqua_contact,contact_id,"The unique, system-generated ID assigned during creation",
becker_eloqua_contact,_fivetran_synced_ts,The time at which fivetran last synced this record,
becker_eloqua_contact_activity,contact_activity_id,"The non-unique, system-generated ID assigned during creation",
becker_eloqua_contact_activity,_fivetran_synced_ts,The time at which fivetran last synced this record,
becker_eloqua_visitor,visitor_id,"Not unique, system-generated ID assigned during creation. The same visitor_id could be appear more than once.",
becker_eloqua_visitor,_fivetran_synced_ts,The time at which fivetran last synced this record,
becker_legacy_gua_campaign_stat,campaign_id,Reference to UA campaign ID.,
becker_legacy_gua_campaign_stat,channel_grouping,"Information about how traffic arrived at your property. The default channel grouping is a rule-based grouping of common sources of traffic, like Paid Search and Direct.",
becker_legacy_gua_campaign_stat,_fivetran_synced_ts,When the row was synced into the destination.,
becker_newt_academic_support_tickets,student_bim_id,Unique identifier for the student in BIM system,
becker_newt_academic_support_tickets,exam_type,Type of exam the ticket is associated with,
becker_newt_academic_support_tickets,section,Exam section the ticket is related to,
becker_newt_academic_support_tickets,closed_ts,Timestamp when the support ticket was closed,
becker_newt_academic_support_tickets,_fivetran_synced_ts,Timestamp when the record was last synced by Fivetran,
becker_newt_exam_tracker_score,exam_type,"Type of exam (cma, cmaState, cpa, cpaState, ea, eaState)",
becker_newt_exam_tracker_score,section,Exam section identifier,
becker_newt_exam_tracker_score,avg_grade,Average grade for the exam section,
becker_newt_exam_tracker_score,_fivetran_synced_ts,Timestamp when the data was last synced from Fivetran,
becker_newt_sf_account,ref_key,Unique reference key for the Salesforce account,
becker_newt_sf_account,account_name,Name of the Salesforce account,
becker_newt_sf_account,account_type,Type/category of the Salesforce account,
becker_newt_sf_account,_fivetran_synced_ts,Timestamp when the record was last synced by Fivetran,
becker_newt_student,unique_key,"Surrogate key combining student_bim_id, exam_type, and sf_contact_id",
becker_newt_student,student_bim_id,Student's BIM identifier,
becker_newt_student,exam_type,Type of exam the student is enrolled in,
becker_newt_student,sf_contact_id,Student's Salesforce contact identifier,
becker_newt_student,first_activity_date,Date of the student's first activity,
becker_newt_student,last_activity_date,Date of the student's last activity,
becker_newt_student,tier,Student tier level,
becker_newt_student,has_logged_in_mobile,Flag indicating if the student has logged in via mobile,
becker_newt_student,_fivetran_synced_ts,Timestamp when Fivetran last synced this record,
becker_newt_student_affiliation,student_bim_id,Unique identifier for the student in BIM system,
becker_newt_student_affiliation,ugrd_university_ref_key,Reference key for undergraduate university,
becker_newt_student_affiliation,ugrd_university,Name of undergraduate university,
becker_newt_student_affiliation,grd_university_ref_key,Reference key for graduate university,
becker_newt_student_affiliation,grd_university,Name of graduate university,
becker_newt_student_affiliation,society_ref_key,Reference key for professional society,
becker_newt_student_affiliation,society,Name of professional society,
becker_newt_student_affiliation,is_military_affiliated,Boolean flag indicating military affiliation,
becker_newt_student_affiliation,employer_ref_key,Reference key for employer,
becker_newt_student_affiliation,employer,Name of employer,
becker_newt_student_affiliation,government_ref_key,Reference key for government entity,
becker_newt_student_affiliation,government,Name of government entity,
becker_newt_student_affiliation,is_graduate,Boolean flag indicating if student has graduated,
becker_newt_student_affiliation,_fivetran_synced_ts,Timestamp when the record was last synced by Fivetran,
becker_newt_student_exam,student_bim_id,Unique identifier for the student in BIM system,
becker_newt_student_exam,exam_type,Type of exam the student is taking,
becker_newt_student_exam,section,Exam section being studied or taken,
becker_newt_student_exam,exam_date,Date the exam was taken,
becker_newt_student_exam,exam_grade,Score/grade received on the exam,
becker_newt_student_exam,exam_grade_input_date,Date the exam grade was entered into the system,
becker_newt_student_exam,first_day_progress_date,Date of first progress recorded for this section,
becker_newt_student_exam,last_day_progress_date,Date of most recent progress recorded for this section,
becker_newt_student_exam,course_progress,Overall course completion percentage,
becker_newt_student_exam,mcqs_progress,Multiple choice questions completion percentage,
becker_newt_student_exam,tbss_progress,Task-based simulations completion percentage,
becker_newt_student_exam,edr_progress,EDR (Electronic Document Review) completion percentage,
becker_newt_student_exam,conceptvideos_progress,Concept videos completion percentage,
becker_newt_student_exam,simexam1_progress,Simulated exam 1 completion percentage,
becker_newt_student_exam,simexam2_progress,Simulated exam 2 completion percentage,
becker_newt_student_exam,miniexams_progress,Mini exams completion percentage,
becker_newt_student_exam,last_section_reset_date,Date the section was last reset,
becker_newt_student_exam,study_time_secs,Total study time in seconds for this section,
becker_newt_student_exam,study_num_days,Number of days studied for this section,
becker_newt_student_exam,is_last_exam,Boolean flag indicating if this is the student's last exam section,
becker_newt_student_exam,newt_conversations,Number of NEWT AI conversations for this section,
becker_newt_student_exam,num_pt_sessions,Number of practice test sessions,
becker_newt_student_exam,num_pt_exam_sessions,Number of practice test exam sessions,
becker_newt_student_exam,_fivetran_synced_ts,Timestamp when the record was last synced by Fivetran,
becker_newt_student_firm,student_bim_id,Unique identifier for the student in BIM system,
becker_newt_student_firm,exam_type,Type of exam the student is associated with,
becker_newt_student_firm,org_id,Unique identifier for the organization/firm,
becker_newt_student_firm,org_name,Name of the organization/firm,
becker_newt_student_firm,_fivetran_synced_ts,Timestamp when the record was last synced by Fivetran,
becker_newt_student_live_online_session,student_bim_id,Unique identifier for the student in BIM system,
becker_newt_student_live_online_session,exam_type,Type of exam the session is for,
becker_newt_student_live_online_session,section,Exam section the live session covered,
becker_newt_student_live_online_session,session_date,Date the live online session occurred,
becker_newt_student_live_online_session,_fivetran_synced_ts,Timestamp when the record was last synced by Fivetran,
becker_newt_student_location,student_bim_id,Unique identifier for the student in BIM system,
becker_newt_student_location,exam_type,Type of exam the student is associated with,
becker_newt_student_location,country_name,Name of the country where student activity was recorded,
becker_newt_student_location,num_days,Number of days student was active from this country,
becker_newt_student_location,_fivetran_synced_ts,Timestamp when the record was last synced by Fivetran,
