model,column,description,Ontology Definition
trc_transaction_line,account_id,Represents the expense account associated with the transaction,
trc_transaction_line,enrollment_id,Represents the ID of the enrollment associated with the transaction,
trc_transaction_line,enrollment_name,Represents the name of the enrollment associated with the transaction,
trc_transaction_line,enrolled_by_id,Represents the ID of the enrolling person of the transaction,
trc_transaction_line,enrolled_by_team,Represents the enrolling team (Customer Service or Web) of the transaction. All B2B and QURE are to be Customer Service. B2C is to be Web,
trc_transaction_line,promo_code,Represents promo code associated with the transaction,
trc_transaction_line,product_tier,Represents tier associated with the product,
trc_transaction_line,product_term,Represents term associated with the product,
trc_transaction_line,date_last_modified,Represents last modified date of the transaction,
trc_transaction_line,transaction_discount_line,Represents the discount associated with the transaction,
trc_transaction_line,gross_amount,Represents gross amount of the transaction,
trc_transaction_line,net_amount,Represents net amount of the transaction,
trc_transaction_line,foreign_amount,Represents foreign amount of the transaction,
trc_transaction_line,est_gross_profit,Represents estimated gross profit from the transaction,
trc_transaction_line,credit_foreign_amount,Represents credit of foreign amount of the transaction,
trc_transaction_line,debit_foreign_amount,Represents debit of foreign amount of the transaction,
trc_transaction_line,rate_amount,Represents rate amount of the transaction,
trc_transaction_line,rate_percent,Represents rate amount percentage of the transaction,
trc_transaction_line,hours,Represents the hours associated with the transaction,
trc_transaction_line,transaction_extid,Represents the external transaction ID associated with the transaction,
trc_transaction_line,course_type_id,Represents the ID of the course type associated with the transaction,
trc_transaction_line,rev_rec_start_date, ,
trc_transaction_line,rev_rec_end_date, ,
trc_transaction_line,refund_reason_id,Represents the refund reason associated with the transaction,
trc_transaction_line,web_source,Represents the web source of the transaction,
trc_transaction_line,license_level_id,Represents the license level id of the transaction,
trc_transaction_line,offering_type_id,Represents the ID of the offering type of the transaction,
trc_transaction_line,seminar_id,Represents seminar ID of the transaction,
trc_transaction_line,original_order_number,ID of the parent (original) order for this transaction,
vps_membership_code,customer_id,Customer identifier,
vps_membership_code,transaction_id,Transaction identifier,
vps_membership_code,transaction_type,Type of transaction (Invoice or Credit Memo),
vps_membership_code,net_amount,Net transaction amount,
vps_membership_code,trandate,Transaction date,
vps_membership_code,email_domain_b2b_flag,Flag indicating B2B email domain (0 or 1),
xcel_historical_categories,transaction_id,Unique identifier for each transaction,
xcel_historical_categories,department_id,Department identifier,
xcel_historical_categories,customer_type,Type of customer,
xcel_historical_categories,company_name,Name of the company,
xcel_historical_categories,top_parent_company_id,Identifier for the top parent company,
xcel_historical_categories,top_parent_company_name,Name of the top parent company,
xcel_historical_categories,parent_company_name,Name of the parent company,
call_agg,ecosystem_id,Unique identifier for the ecosystem,
call_agg,ecosystem_name,Name of the ecosystem,
call_agg,brand_id,Unique identifier for the brand,
call_agg,brand_name,Name of the brand,
call_agg,source_name,Name of the call source system,
call_agg,call_ts,30-minute time interval timestamp (YYYY-MM-DD HH:MM:SS),
call_agg,call_date,Date of the calls,
call_agg,total_calls,Total number of calls in the half-hour interval,
call_agg,unique_calls,Total number of unique calls in the half-hour interval,
call_agg,calls_answered,Number of calls that were answered,
call_agg,calls_missed,Number of calls that were missed,
call_agg,calls_abandoned,Number of calls that were abandoned,
call_agg,first_call_resolutions,Number of calls resolved on first contact,
call_agg,calls_with_transfer,Number of calls that involved a transfer,
call_agg,transfer_rate,Percentage of calls that involved a transfer (0-1 scale),
call_agg,avg_handle_time_seconds,Average call handle time in seconds,
call_agg,avg_queue_wait_time_seconds,Average queue wait time in seconds,
call_agg,longest_queue_wait_time_seconds,Maximum queue wait time in seconds for the interval,
call_agg,calls_within_sla,Number of calls that met SLA requirements,
call_agg,calls_outside_sla,Number of calls that did not meet SLA requirements,
call_agg,service_level_compliance_rate,Percentage of calls meeting SLA (0-1 scale),
call_agg,service_level_non_compliance_rate,Percentage of calls not meeting SLA (0-1 scale),
call_fact,ecosystem_id,Represents the primary ecosystem ID of the subsidiary/brand,
call_fact,ecosystem_name,Represents the primary ecosystem of the subsidiary/brand,
call_fact,brand_id,"The unique, system-generated ID assigned to the brand/subsidiary",
call_fact,brand_name,Represents the name of the subsidiary/brand,
call_fact,source_name,"Source system for the call data, currently 'Five9'",
call_fact,call_id,Unique identifier for each call in the Five9 system,
call_fact,agent_name,The name of the Five9 agent who handled the call,
call_fact,brand_campaign,The specific brand that the agent was supporting during this call interaction,
call_fact,skill,"The specific skill or skill group that was required or used for handling the call. Five9 uses skills-based routing to match callers with appropriately skilled agents.
",
call_fact,caller_phone_number,Caller phone number,
call_fact,call_cost,Cost associated with the call based on Five9 billing metrics,
call_fact,contacted_count,Number of successful contacts made during the call,
call_fact,call_billed_time_seconds,"Total billable time for the call, rounded according to Five9 billing rules",
call_fact,call_time_seconds,Total duration of the call from start to finish,
call_fact,handle_time_seconds,Total time spent handling the call (talk time + hold time + after call work),
call_fact,talk_time_seconds,Time spent with the agent and caller in active conversation,
call_fact,ring_time_seconds,Time the call spent ringing before being answered,
call_fact,ivr_time_seconds,Time the caller spent in the Interactive Voice Response (IVR) system,
call_fact,after_call_work_time_seconds,Time spent by agents completing post-call tasks (in seconds),
call_fact,pci_call_billed_time_seconds,"The rounded billable time for calls routed through the PCI payment processing system, representing the total time for billing purposes.",
call_fact,pci_call_time_seconds,"Total duration of calls processed through the PCI secure payment gateway from beginning to end, including all call components.",
call_fact,pci_handle_time_seconds,"Total time spent handling the secure payment call, including time in the PCI payment system and any after-call work.",
call_fact,pci_talk_time_seconds,Time (in seconds) spent in conversation during the secure payment call before and after the PCI payment processing component.,
call_fact,pci_ring_time_seconds,Time (in seconds) the call spent ringing before being connected to the PCI secure payment system.,
call_fact,pci_ivr_time_seconds,Time (in seconds) the caller spent in the Interactive Voice Response (IVR) system before being routed to the PCI secure payment gateway.,
call_fact,pci_after_call_work_time_seconds,Time (in seconds) spent by agents on post-call administrative tasks after the secure payment call has completed.,
call_fact,total_call_billed_time_seconds,Sum of regular call billed time and PCI call billed time,
call_fact,total_call_time_seconds,Sum of regular call time and PCI call time,
call_fact,total_handle_time_seconds,Sum of regular handle time and PCI handle time,
call_fact,total_talk_time_seconds,Sum of regular talk time and PCI talk time,
call_fact,total_ring_time_seconds,Sum of regular ring time and PCI ring time,
call_fact,total_ivr_time_seconds,Sum of regular IVR time and PCI IVR time,
call_fact,total_after_call_work_time_seconds,Sum of regular after-call work time and PCI after-call work time,
call_fact,call_holds,Number of times the call was placed on hold,
call_fact,has_call_transfer,Boolean flag indicating if the call was transferred,
call_fact,is_call_answered,Boolean flag indicating if the call was answered by an agent,
call_fact,is_call_missed,Boolean flag indicating if the call was missed or not answered by an agent,
call_fact,is_call_abandoned,Boolean flag indicating if the call was abandoned by the caller,
call_fact,is_within_sla,Boolean flag indicating if the call was handled within the defined Service Level Agreement (SLA) time of 30 seconds,
call_fact,is_first_call_resolution,Boolean flag indicating if the call was resolved on the first contact without the need for follow-up,
call_fact,third_party_talk_time_seconds,Time spent talking with third parties during call transfers or conferences,
call_fact,consult_time_seconds,Time spent by agents consulting with others while the caller is on hold,
call_fact,dial_time_seconds,Time spent dialing out (relevant for outbound calls),
call_fact,hold_time_seconds,Total time the caller was placed on hold during the call,
call_fact,manual_time_seconds,Time spent on manual activities during the call,
call_fact,park_time_seconds,Time the call was in a parked state,
call_fact,queue_wait_time_seconds,Time the caller spent waiting in queue before being connected to an agent,
call_fact,talk_time_less_hold_and_park_seconds,Talk time excluding periods when the call was on hold or parked,
call_fact,time_to_abandon_call_seconds,Time elapsed before an abandoned call was terminated by the caller,
call_fact,total_queue_time_seconds,Total time the call spent in any queue,
call_fact,call_date,Date when the call occurred,
call_fact,call_ts,The timestamp when the call occurred,
call_fact,_fivetran_synced_ts,Timestamp when the record was last synced by Fivetran,
case_fact,case_id,Unique identifier for each Case record in Salesforce,
case_fact,case_number,Auto-generated case number displayed in the Salesforce UI for reference,
case_fact,customer_id,Foreign key to the customer dimension table,
case_fact,owner_id,ID of the Salesforce user or queue that owns the case,
case_fact,case_origin,"Channel through which the case was submitted (e.g., Email, Web, Phone)",
case_fact,case_subject,Brief description of the issue or inquiry,
case_fact,category,Primary categorization of the case issue (custom field),
case_fact,category_level_2,Secondary categorization providing more specificity about the issue (custom field),
case_fact,category_level_3,Tertiary categorization providing even more detailed classification (custom field),
case_fact,course_category,Category of the course related to the case (custom field),
case_fact,course,Specific course related to the customer inquiry or issue (custom field),
case_fact,product_name,Name of the product relevant to the case (custom field),
case_fact,queue_name,Name of the queue to which the case is assigned (custom field),
case_fact,created_ts,Timestamp when the case was created in Salesforce,
case_fact,case_closed_date,Date and time when the case was closed or resolved,
case_fact,completed_by,User who marked the case as completed or resolved (custom field),
case_fact,completed_ts,Timestamp when the case was marked as completed (custom field),
case_fact,case_duration_days,Number of days between case creation and closure,
case_fact,is_closed,Boolean flag indicating if the case has been closed,
case_fact,has_survey_sent,Boolean flag indicating if a survey was sent for this case,
case_fact,_fivetran_synced_ts,Timestamp when the record was last synced from Fivetran,
nursing_entity_master,entity_key,Unique identifier for each record (from nursing_entity.entity_id),
nursing_entity_master,customer_id,Customer ID from source system,
nursing_entity_master,brand_id,Brand ID (NULL for license records),
nursing_entity_master,brand_name,Brand name (NULL for license records),
nursing_entity_master,source_system,Source system (NULL for license records),
nursing_entity_master,entity_type,Entity type - 'customer' or 'license',
nursing_entity_master,customer_email,Customer email address,
nursing_entity_master,first_name,Customer first name,
nursing_entity_master,last_name,Customer last name,
nursing_entity_master,full_name,Customer full name,
nursing_entity_master,phone,Customer phone number,
nursing_entity_master,address,Customer address,
nursing_entity_master,city,Customer city,
nursing_entity_master,state,Customer state,
nursing_entity_master,zip,Customer zip code,
nursing_entity_master,country,Customer country,
nursing_entity_master,license_number,Nursing license number (only populated for license entity_type records),
nursing_entity_master,license_level_name,License level (only populated for license entity_type records),
nursing_entity_master,license_state,State where license was issued (only populated for license entity_type records),
nursing_entity_master,profession_name,Profession classification (only populated for license entity_type records),
nursing_entity_master,customer_license_id,License ID from customer_license_dim (only populated for license entity_type records),
nursing_entity_master,license_expiration_date,License expiration date (only populated for license entity_type records),
nursing_entity_master,education_renewal_date,Education renewal date for filtering recent licenses (only populated for license entity_type records),
nursing_entity_master,do_not_market,Do not market flag from license record (only populated for license entity_type records),
nursing_entity_master,do_not_mail,Do not mail flag from customer record (only populated for license entity_type records),
nursing_entity_master,first_sale_date,First sale date,
nursing_entity_master,last_sale_date,Last sale date,
nursing_entity_master,master_key,Hashed key linking all matched entities in a cluster,
nursing_entity_master,cluster_size,Count of entities in this cluster,
nursing_entity_master,is_cluster_root,Flag indicating if this entity is the representative (root) of its cluster,
nursing_entity_master,may_need_more_iterations,"Flag indicating if this entity's component_id changed between iteration 6 and 7.
If true, the algorithm may not have fully converged for this entity's cluster.
Use to monitor if 7 iterations is sufficient - query for count where this is true.
",
nursing_entity_master,has_customer_in_cluster,"TRUE if this master_key has at least one customer record.
Indicates the person has purchased from at least one nursing brand.
",
nursing_entity_master,is_true_prospect,"TRUE if this master_key has NO customer records.
Indicates the person has never purchased from any nursing brand (license-only).
",
nursing_entity_master,dw_update_ts,Data warehouse update timestamp,
nursing_entity_matching,entity_id_1,Entity ID from the first record in the pair (from nursing_entity),
nursing_entity_matching,customer_id_1,Customer ID from the first record in the pair,
nursing_entity_matching,brand_id_1,Brand ID from the first record in the pair (NULL for prospects),
nursing_entity_matching,brand_name_1,Brand name from the first record in the pair (NULL for prospects),
nursing_entity_matching,entity_type_1,Entity type of the first record - 'customer' or 'license',
nursing_entity_matching,entity_id_2,Entity ID from the second record in the pair (from nursing_entity),
nursing_entity_matching,customer_id_2,Customer ID from the second record in the pair,
nursing_entity_matching,brand_id_2,Brand ID from the second record in the pair (NULL for prospects),
nursing_entity_matching,brand_name_2,Brand name from the second record in the pair (NULL for prospects),
nursing_entity_matching,entity_type_2,Entity type of the second record - 'customer' or 'license',
nursing_entity_matching,match_type,"Type of match that generated this pair (email, phone, zip_street, address, or license)",
nursing_entity_matching,email_1,Cleaned email address from the first record,
nursing_entity_matching,email_2,Cleaned email address from the second record,
nursing_entity_matching,phone_1,Cleaned phone number from the first record,
nursing_entity_matching,phone_2,Cleaned phone number from the second record,
nursing_entity_matching,first_name_1,Cleaned first name from the first record,
nursing_entity_matching,first_name_2,Cleaned first name from the second record,
nursing_entity_matching,last_name_1,Cleaned last name from the first record,
nursing_entity_matching,last_name_2,Cleaned last name from the second record,
nursing_entity_matching,address_1,Cleaned address from the first record,
nursing_entity_matching,address_2,Cleaned address from the second record,
nursing_entity_matching,email_score,"Jaro-Winkler similarity score between email addresses (0-1), or NULL if no email comparison was made",
nursing_entity_matching,phone_score,"Jaro-Winkler similarity score between phone numbers (0-1), or NULL if no phone comparison was made",
nursing_entity_matching,name_score,"Jaro-Winkler similarity score between concatenated names (0-1), or NULL if no name comparison was made",
nursing_entity_matching,address_score,"Jaro-Winkler similarity score between addresses (0-1), or NULL if no address comparison was made",
nursing_entity_matching,final_score,"Weighted average similarity score across all matching fields. Score is 1.0 if exact name match plus exact match on email, phone+address, or address. Otherwise calculated as average of available field scores.
",
calendar_dim,date_day,Primary date field in the calendar dimension,
calendar_dim,date_key,Integer representation of date in YYYYMMDD format,
calendar_dim,date,Date in standard date format,
calendar_dim,day,Day of month (1-31),
calendar_dim,day_suffix,"Suffix for the day (st, nd, rd, th)",
calendar_dim,weekday,Day of week as a number (0-6),
calendar_dim,weekday_name,Full name of the day of week,
calendar_dim,weekday_name_short,Three-letter abbreviation of weekday name,
calendar_dim,weekday_name_first_letter,First letter of weekday name,
calendar_dim,day_of_year,Day of year (1-366),
calendar_dim,week_of_month,Week number within the month,
calendar_dim,week_of_year,Week number within the year,
calendar_dim,month,Month number (1-12),
calendar_dim,month_name,Full name of the month,
calendar_dim,month_name_short,Three-letter abbreviation of month name,
calendar_dim,month_name_first_letter,First letter of month name,
calendar_dim,quarter,Quarter of the year (1-4),
calendar_dim,quarter_name,Quarter name (Q1-Q4),
calendar_dim,year,Year (YYYY),
calendar_dim,year_month,Year and month in YYYY-MM format,
calendar_dim,is_weekend,Boolean flag indicating if date is a weekend,
calendar_dim,first_date_of_year,First date of the year for this date,
calendar_dim,last_date_of_year,Last date of the year for this date,
calendar_dim,first_date_of_quarter,First date of the quarter for this date,
calendar_dim,last_date_of_quarter,Last date of the quarter for this date,
calendar_dim,first_date_of_month,First date of the month for this date,
calendar_dim,last_date_of_month,Last date of the month for this date,
calendar_dim,first_date_of_week,First date of the week for this date,
calendar_dim,last_date_of_week,Last date of the week for this date,
calendar_dim,day_artifact,Formatted day and short weekday name for display purposes,
calendar_dim,month_artifact,Formatted year and short month name for display purposes,
calendar_dim,dynamic_month,"Dynamic month label showing 'CURRENT MO', 'LAST MO', or month name",
calendar_dim,dynamic_year,"Dynamic year label showing 'CURRENT YR', 'LAST YR', or year value",
calendar_dim,week_end_flag,Flag indicating if the date is a Friday (end of work week),
calendar_dim,week_end_date,"Date value if the date is a Friday, otherwise null",
calendar_dim,forecast_week,"Week of month if the date is a Friday, otherwise null",
calendar_dim,project_sprint,Date representing the project sprint start (Monday of the week),
calendar_dim,holiday_name,"Name of the US Federal Holiday, if applicable",
calendar_dim,is_holiday,Boolean flag indicating if the date is a recognized US Federal Holiday,
calendar_dim,offset_current_year,Number of years between current date and this date,
calendar_dim,offset_current_quarter,Number of quarters between current date and this date,
calendar_dim,offset_current_month,Number of months between current date and this date,
calendar_dim,offset_current_week,Number of weeks between current date and this date,
calendar_dim,offset_current_day,Number of days between current date and this date,
calendar_dim,ly_date,The date exactly one year prior to this date,
calendar_dim,y2y_date,The date exactly two years prior to this date,
calendar_dim,ly_week_aligned_date,The date 52 weeks prior to this date (day-of-week aligned),
calendar_dim,y2y_week_aligned_date,The date 104 weeks prior to this date (day-of-week aligned),
calendar_dim,day_of_month,Numerical day of the month (1-31),
calendar_dim,day_of_quarter,Numerical day within the current quarter,
financial_transaction_line_fact,unique_id,Surrogate key for the transaction line from netsuite dataset. Build on top of transaction_id and transaction_line_id,
financial_transaction_line_fact,brand_id,"Id for Subsidary / brand, eg. 1 for Colibri, 2 for Becker, etc",
financial_transaction_line_fact,brand_name,"Name of the Subsidary / brand, eg, Colibri, Becker",
financial_transaction_line_fact,source_name,"Name of the original source where the data comes from, eg. Salesforce, Netsuite",
financial_transaction_line_fact,accounting_period_id,The unique identifier of the account_period,
financial_transaction_line_fact,transaction_id,ID of the transaction,
financial_transaction_line_fact,transaction_line_id,ID of the transaction line,
financial_transaction_line_fact,transaction_ts,Represents the date of the transaction,
financial_transaction_line_fact,transaction_date,Represents the date of the transaction,
financial_transaction_line_fact,transaction_type,Represents the type of transaction,
financial_transaction_line_fact,item_id,Represents the ID of the item associated with the transaction,
financial_transaction_line_fact,profession_id,Represents the ID of the profession associated with the transaction,
financial_transaction_line_fact,profession_name,Represents the name of the profession associated with the transaction,
financial_transaction_line_fact,education_type_id,Represents the ID of the education type associated with the transaction,
financial_transaction_line_fact,education_type_name,Represents the name of the education type associated with the transaction,
financial_transaction_line_fact,delivery_method_id,Represents the ID of the delivery method associated with the transaction,
financial_transaction_line_fact,delivery_method_name,Represents the name of the delivery method associated with the transaction,
financial_transaction_line_fact,state_id,Represents the ID of the state associated with the transaction,
financial_transaction_line_rpt,acc_id,Represents Id of Account,
financial_transaction_line_rpt,account_type,Represents account type field from netsuite,
financial_transaction_line_rpt,account_full_name,Represents account full name field from netsuite,
financial_transaction_line_rpt,tl_account_id,Represents Id of Account,
financial_transaction_line_rpt,subsidary_id,"Id for Subsidary / brand, eg. 1 for Colibri, 2 for Becker, etc",
financial_transaction_line_rpt,subsidary,"Name of the Subsidary / brand, eg, Colibri, Becker",
financial_transaction_line_rpt,accounting_period_id,The unique identifier of the account_period,
financial_transaction_line_rpt,transaction_id,ID of the transaction,
financial_transaction_line_rpt,last_modified_ts,Represents the last modified date of the transaction,
financial_transaction_line_rpt,created_ts,Represents the  create date of the transaction,
financial_transaction_line_rpt,posting_period,Represents the  posting date of the transaction,
financial_transaction_line_rpt,transaction_date,Represents the date of the transaction,
financial_transaction_line_rpt,transaction_type,Represents the type of transaction,
financial_transaction_line_rpt,class_id,Represents the ID of the profession associated with the transaction,
financial_transaction_line_rpt,profession_id,Represents the ID of the profession associated with the transaction,
financial_transaction_line_rpt,profession_id_for_ecosystem,Represents the ID of the profession associated with the transaction for ecosystem,
financial_transaction_line_rpt,education_type_id,Represents the ID of the education type associated with the transaction,
financial_transaction_line_rpt,delivery_method_id,Represents the ID of the delivery method associated with the transaction,
financial_transaction_line_rpt,state_id,Represents the ID of the state associated with the transaction,
financial_transaction_line_rpt,is_posting,Represents boolean field represented as T/F for netsuite posting,
financial_transaction_line_rpt,sum_amount,Represents the net amount of transaction,
employee_dim,employee_id,Unique ID of the employee,
employee_dim,employee_first_name,First name of employee,
employee_dim,employee_last_name,Last name of employee,
employee_dim,employee_full_name,Full name of employee. Build from first name and last name,
employee_dim,team,Name of team the employee belongs to,
